{
  "aliases": [],
  "artifacts": [],
  "created_at": "2026-09-24T20:44:16Z",
  "extensions": {},
  "id": "urn:uuid:dcb48733-b28f-4a33-bc42-c2498fb8f30a",
  "name": "author-apm-skills",
  "notes": "",
  "preferred_source_id": "urn:uuid:9030565e-9ebf-406f-a30e-02cb413092cb",
  "relations": [],
  "schema": "https://github.com/leej3/skills-workshop/schemas/memory/skill-v0.schema.json",
  "sources": [
    {
      "external_ids": {},
      "first_seen_at": "2026-09-24T20:44:16Z",
      "id": "urn:uuid:c0c87edd-dd08-4ce1-99d1-04674cc53371",
      "kind": "git",
      "locator": "https://github.com/con/skills.git",
      "notes": "Proposed in draft PR https://github.com/con/skills/pull/11; not yet merged.",
      "role": "canonical",
      "subpath": "skills/author-apm-skills"
    },
    {
      "external_ids": {},
      "first_seen_at": "2026-09-24T20:44:16Z",
      "id": "urn:uuid:9030565e-9ebf-406f-a30e-02cb413092cb",
      "kind": "git",
      "locator": "https://github.com/leej3/skills.git",
      "notes": "Validated distribution revision c6ab62f0e03ad1aae22893f06126558e82797761.",
      "role": "fork",
      "subpath": "skills/author-apm-skills"
    }
  ],
  "summary": "Author, package, and assess reusable skills specifically for APM distribution.",
  "tag_ids": [],
  "updated_at": "2026-09-24T20:44:16Z"
}
